{
  "$schema":"https://json-schema.org/draft/2020-12/schema","$id":"campaign.schema.json","title":"External staged probe campaign","type":"object",
  "required":["schema_version","campaign_id","description","document_expectations","view_registry","job_templates","stages","dependencies","acceptance_requirements","execution_defaults","diagnostic_expansion_rules"],
  "properties":{"schema_version":{"const":"1.0"},"campaign_id":{"type":"string","pattern":"^[A-Za-z0-9][A-Za-z0-9._-]{0,127}$"},"description":{"type":"string"},"document_expectations":{"type":"object","required":["expected_title"]},"view_registry":{"type":"object","additionalProperties":{"$ref":"#/$defs/view"}},"job_templates":{"type":"object"},"stages":{"type":"array","items":{"$ref":"#/$defs/stage"}},"dependencies":{"type":"array","items":{"$ref":"#/$defs/dependency"}},"acceptance_requirements":{"type":"object"},"execution_defaults":{"type":"object","required":["batch_size"],"properties":{"batch_size":{"type":"integer","minimum":1},"on_job_error":{"enum":["stop","continue"]}}},"diagnostic_expansion_rules":{"type":"array","items":{"type":"object","required":["rule_id"]}},"conditional_fallbacks":{"type":"array","items":{"$ref":"#/$defs/conditional_fallback"}}},
  "$defs":{"view":{"type":"object","required":["unique_id","expected_name","expected_view_type","expected_crop_active","roles","source_content_tags"],"properties":{"unique_id":{"type":"string"},"expected_name":{"type":"string"},"expected_view_type":{"type":"string"},"expected_crop_active":{"type":"boolean"},"roles":{"type":"array","items":{"type":"string"}},"source_content_tags":{"type":"array","items":{"type":"string"}},"notes":{"type":"string"}}},"job":{"type":"object","required":["job_key","view_key","probe_id","case","variant","repetition","settings"],"properties":{"job_key":{"type":"string"},"view_key":{"type":"string"},"probe_id":{"type":"string"},"case":{"type":"string"},"variant":{"type":"string"},"repetition":{"type":"integer","minimum":1},"settings":{"type":"object"},"manual_review_required":{"type":"boolean"},"manual_review_reason":{"type":"string"},"output_directory":{"type":"string"}}},"stage":{"type":"object","required":["stage_id","description","jobs"],"properties":{"stage_id":{"type":"string"},"description":{"type":"string"},"jobs":{"type":"array","items":{"$ref":"#/$defs/job"}}}},"dependency":{"type":"object","required":["job","statuses"],"properties":{"job":{"type":"string"},"requires_job":{"type":"string"},"requires_closure":{"type":"string"},"statuses":{"type":"array","items":{"enum":["PASS","FAIL","INCONCLUSIVE","BLOCKED"]}}}},"conditional_fallback":{"type":"object","required":["fallback_id","trigger_job","trigger_reason_codes","fallback_job"],"properties":{"fallback_id":{"type":"string"},"trigger_job":{"type":"string"},"trigger_reason_codes":{"type":"array","minItems":1,"items":{"type":"string"}},"fallback_job":{"$ref":"#/$defs/job"},"description":{"type":"string"}}}}
}
